### ISSUE TITLE
xdp-dump tests failing...

### ISSUE THREAD

**Issue by tohojo** [xdp-project/xdp-tools#85]
```
     [test_capt_pcap]              FAIL
	PING fc42:dead:cafe:1::2(fc42:dead:cafe:1::2) 56 data bytes
	64 bytes from fc42:dead:cafe:1::2: icmp_seq=1 ttl=64 time=0.068 ms
	
	--- fc42:dead:cafe:1::2 ping statistics ---
	1 packets transmitted, 1 received, 0% packet loss, time 0ms
	rtt min/avg/max/mdev = 0.068/0.068/0.068/0.000 ms
	PING fc42:dead:cafe:1::2(fc42:dead:cafe:1::2) 56 data bytes
	64 bytes from fc42:dead:cafe:1::2: icmp_seq=1 ttl=64 time=0.047 ms
	
	--- fc42:dead:cafe:1::2 ping statistics ---
	1 packets transmitted, 1 received, 0% packet loss, time 0ms
	rtt min/avg/max/mdev = 0.047/0.047/0.047/0.000 ms
	../lib/testing/test_runner.sh: line 109: kill: (-22436) - No such process
	reading from file -, link-type EN10MB (Ethernet), snapshot length 262144
	23:24:35.836630 IP6 :: > ff02::1:ff63:4b64: ICMP6, neighbor solicitation, who has fe80::f496:a8ff:fe63:4b64, length 32
	23:24:36.380195 IP6 fc42:dead:cafe:1::2 > fc42:dead:cafe:1::1: ICMP6, echo reply, id 174, seq 1, length 64
	tcpdump: pcap_loop: error reading dump file: Interrupted system call
	ERROR: IPv6 packet not received
     [test_capt_pcapng]            FAIL
	PING fc42:dead:cafe:1::2(fc42:dead:cafe:1::2) 56 data bytes
	64 bytes from fc42:dead:cafe:1::2: icmp_seq=1 ttl=64 time=0.075 ms
	
	--- fc42:dead:cafe:1::2 ping statistics ---
	1 packets transmitted, 1 received, 0% packet loss, time 0ms
	rtt min/avg/max/mdev = 0.075/0.075/0.075/0.000 ms
	PING fc42:dead:cafe:1::2(fc42:dead:cafe:1::2) 56 data bytes
	64 bytes from fc42:dead:cafe:1::2: icmp_seq=1 ttl=64 time=0.047 ms
	
	--- fc42:dead:cafe:1::2 ping statistics ---
	1 packets transmitted, 1 received, 0% packet loss, time 0ms
	rtt min/avg/max/mdev = 0.047/0.047/0.047/0.000 ms
	../lib/testing/test_runner.sh: line 109: kill: (-22465) - No such process
	reading from file -, link-type EN10MB (Ethernet), snapshot length 262144
	23:24:39.359278 IP6 fc42:dead:cafe:1::2 > fc42:dead:cafe:1::1: ICMP6, echo reply, id 176, seq 1, length 64
	tcpdump: pcap_loop: error reading dump file: Interrupted system call
	ERROR: IPv6 packet not received
```

**Comment by chaudron** [comment]
I think we discussed this before, this is an issue in the test infrastructure that sometimes the system is not setup correctly. If you re-run it, it will work. Thought you where looking into this? I do not see this on RHEL, so far, only on Fedora.

But just to be sure I tried it on RHEL8.3 and Fedora32 and it works fine (after a second try on fedora).

Fedora 32:
    Running tests from tests/test-xdpdump.sh
     [test_help]                   PASS
     [test_interfaces]             PASS
     [test_capt_pcap]              PASS
     [test_capt_pcapng]            PASS
     [test_capt_term]              PASS
     [test_exitentry]              PASS
     [test_snap]                   PASS
     [test_multi_pkt]              PASS
     [test_perf_wakeup]            PASS
     [test_promiscuous]            PASS
     [test_none_xdp]               PASS
     [test_pname_parse]            PASS
     [test_multi_prog]             PASS
     [test_xdp_load]               PASS

RHEL8.3 (4.18.0-271.el8.x86_64):
[Need to look why multiple is failing, might be some kernel issue, guess not xdpdump related!]
$ make test
    Running tests from tests/test-xdpdump.sh
     [test_help]                   PASS
     [test_interfaces]             PASS
     [test_capt_pcap]              PASS
     [test_capt_pcapng]            PASS
     [test_capt_term]              PASS
     [test_exitentry]              PASS
     [test_snap]                   PASS
     [test_multi_pkt]              PASS
     [test_perf_wakeup]            PASS
     [test_promiscuous]            PASS
     [test_none_xdp]               PASS
     [test_pname_parse]            PASS
     [test_multi_prog]             FAIL
	../lib/testing/test_runner.sh: line 107: kill: (-347508) - No such process
	../lib/testing/test_runner.sh: line 109: kill: (-347508) - No such process
	PING fc42:dead:cafe:1::2(fc42:dead:cafe:1::2) 56 data bytes
	64 bytes from fc42:dead:cafe:1::2: icmp_seq=1 ttl=64 time=0.032 ms
	
	--- fc42:dead:cafe:1::2 ping statistics ---
	1 packets transmitted, 1 received, 0% packet loss, time 0ms
	rtt min/avg/max/mdev = 0.032/0.032/0.032/0.000 ms
	../lib/testing/test_runner.sh: line 107: kill: (-347534) - No such process
	../lib/testing/test_runner.sh: line 109: kill: (-347534) - No such process
	ERROR: Can't load eBPF object: Kernel verifier blocks program loading(-4007)
	ERROR: Not received all fentry packets
     [test_xdp_load]               PASS

**Comment by chaudron** [comment]
Quickly checked an RHEL is missing the following commit:

'''
43bc2874e779 bpf: Fix context type resolving for extension programs
'''

This is causing the failure on RHEL.

 @tohojo what system are you using that is failing, and did a second/third try pass?

**Comment by chaudron** [comment]
@tohojo looks like your tcpdump has the "id" field added to the output. What version do you have so I can replicate it.

**Comment by tohojo** [comment]
Eelco Chaudron <notifications@github.com> writes:

> @tohojo looks like your tcpdump has the "id" field added to the
> output. What version do you have so I can replicate it.

$ tcpdump --version
tcpdump version 4.99.0
libpcap version 1.10.0 (with TPACKET_V3)
OpenSSL 1.1.1i  8 Dec 2020

(And yeah, I thought it was just that same transient error we'd been
talking about, but I couldn't get it to pass at all; guess that explains
it :))
